<?xml version="1.0" encoding="UTF-8" ?>

<!ELEMENT mapper (script* | insert* | update* | delete* | select* )+>
<!ATTLIST mapper
xmlns:fo CDATA #IMPLIED
namespace CDATA #IMPLIED
>

<!ELEMENT select (#PCDATA | include | trim | where | set | foreach | choose | if)*>
<!ATTLIST select
id CDATA #REQUIRED
index CDATA #IMPLIED
type CDATA #IMPLIED
parameterType CDATA #IMPLIED
resultType CDATA #IMPLIED
>

<!ELEMENT insert (#PCDATA |  include | trim | where | set | foreach | choose | if)*>
<!ATTLIST insert
id CDATA #REQUIRED
index CDATA #IMPLIED
type CDATA #IMPLIED
parameterType CDATA #IMPLIED
>

<!ELEMENT update (#PCDATA | include | trim | where | set | foreach | choose | if)*>
<!ATTLIST update
id CDATA #REQUIRED
index CDATA #IMPLIED
type CDATA #IMPLIED
parameterType CDATA #IMPLIED
>

<!ELEMENT delete (#PCDATA | include | trim | where | set | foreach | choose | if)*>
<!ATTLIST delete
id CDATA #REQUIRED
index CDATA #IMPLIED
type CDATA #IMPLIED
parameterType CDATA #IMPLIED
>

<!-- Dynamic -->

<!ELEMENT include EMPTY>
<!ATTLIST include
refid CDATA #REQUIRED
>

<!ELEMENT script (#PCDATA | include | trim | where | set | foreach | choose | if)*>
<!ATTLIST script
id CDATA #REQUIRED
>

<!ELEMENT trim (#PCDATA | include | trim | where | set | foreach | choose | if)*>
<!ATTLIST trim
prefix CDATA #IMPLIED
prefixOverrides CDATA #IMPLIED
suffix CDATA #IMPLIED
suffixOverrides CDATA #IMPLIED
>
<!ELEMENT where (#PCDATA | include | trim | where | set | foreach | choose | if)*>
<!ELEMENT set (#PCDATA | include | trim | where | set | foreach | choose | if)*>

<!ELEMENT foreach (#PCDATA | include | trim | where | set | foreach | choose | if)*>
<!ATTLIST foreach
collection CDATA #REQUIRED
item CDATA #IMPLIED
index CDATA #IMPLIED
open CDATA #IMPLIED
close CDATA #IMPLIED
separator CDATA #IMPLIED
>

<!ELEMENT choose (when* , otherwise?)>
<!ELEMENT when (#PCDATA | include | trim | where | set | foreach | choose | if)*>
<!ATTLIST when
test CDATA #REQUIRED
>
<!ELEMENT otherwise (#PCDATA | include | trim | where | set | foreach | choose | if)*>

<!ELEMENT if (#PCDATA | include | trim | where | set | foreach | choose | if)*>
<!ATTLIST if
test CDATA #REQUIRED
>


